{
  "seller_id": "seller_abc",
  "garment_id": "garment_top_001",
  "garment_type": "top",
  "images": [
    {
      "url": "https://cdn.example.com/garments/top_001_front.jpg",
      "view": "front"
    },
    {
      "url": "https://cdn.example.com/garments/top_001_back.jpg",
      "view": "back"
    }
  ],
  "metadata": {
    "brand": "ExampleBrand",
    "size_label": "M",
    "material": "cotton",
    "color": "navy"
  }
}
