{
  "seller_id": "seller_xyz",
  "garment_id": "garment_dress_bad_001",
  "garment_type": "dress",
  "images": [
    {
      "url": "https://cdn.example.com/garments/dress_bad_front.jpg",
      "view": "front"
    }
  ],
  "metadata": {
    "brand": "TestBrand",
    "size_label": "L",
    "material": "polyester"
  }
}
